<?xml version="1.0" encoding="ISO-8859-1"?>
<!DOCTYPE product PUBLIC "-//Tricklab//DTD Product V1.0//EN" "Product.dtd">

<!-- Description: Table, no attributes, titles -->

<product version="1.0">
      <table>
         <column>
            <var>sys.exec.out.time</var>
         </column>
         <column>
            <var>sun_predictor.sun.solar_azimuth</var>
         </column>
         <column>
            <var>sun_predictor.sun.solar_elevation</var>
         </column>
      </table>
</product>
