<?xml version="1.0" encoding="ISO-8859-1"?>
<!DOCTYPE product PUBLIC "-//Tricklab//DTD Product V1.0//EN" "../../XML/DTD/Product.dtd">

<!-- Description: Plot of Z(t) vs. Y(t) vs. X(t), with attributes, titles, labels, units -->

<product version="1.0"
		 foreground_color="#000000"
		 background_color="#ffffff">
   <title>title of the product</title>
   <page>
      <title>Solar Elevation for a Day</title>
      <plot grid="yes"
            font="-*-new century schoolbook-bold-r-*--12-*-*-*-*-*-*-*"
            background_color="#fffff0">
         <title>Sun Time vs. Elevation vs. Azimuth</title>
         <xaxis>
            <label>Azimuth</label>
            <units>d</units>
         </xaxis>
         <yaxis format="%g">
            <label>Elevation</label>
            <units>d</units>
         </yaxis>
         <zaxis>
            <label>Time</label>
            <units>s</units>
         </zaxis>
         <curve>
            <var>sun_predictor.sun.solar_azimuth</var>
            <var line_color = "#323200">sun_predictor.sun.solar_elevation</var>
            <var>sys.exec.out.time</var>
         </curve>
      </plot>
   </page>
</product>
