<?xml version="1.0" encoding="ISO-8859-1" standalone="no"?>
<!DOCTYPE product PUBLIC "-//Tricklab//DTD Product V1.0//EN" "Product.dtd">
<product version="1.0">
    <tstart>-1.0E20</tstart>
    <tstop>1.0E20</tstop>
    <frequency>0.0</frequency>
    <page hcells="0" vcells="0">
        <title>Page</title>
        <plot grid="Yes" grid_color="#b2b2b2">
            <title>Plot</title>
            <curve>
                <var units="s">sys.exec.out.time</var>
                <var units="m">dyn.parachutist.altitude</var>
            </curve>
        </plot>
    </page>
    <page hcells="0" vcells="0">
        <title>Page</title>
        <plot grid="Yes" grid_color="#b2b2b2">
            <title>Plot</title>
            <curve>
                <var units="s">sys.exec.out.time</var>
                <var units="m/s">dyn.parachutist.velocity</var>
            </curve>
        </plot>
    </page>
    <page hcells="0" vcells="0">
        <title>Page</title>
        <plot grid="Yes" grid_color="#b2b2b2">
            <title>Plot</title>
            <curve>
                <var units="s">sys.exec.out.time</var>
                <var units="m/s2">dyn.parachutist.acceleration</var>
            </curve>
        </plot>
    </page>
    <page hcells="0" vcells="0">
        <title>Page</title>
        <plot grid="Yes" grid_color="#b2b2b2">
            <title>Plot</title>
            <curve>
                <var units="s">sys.exec.out.time</var>
                <var units="--">dyn.parachutist.cooefficientOfDrag</var>
            </curve>
        </plot>
    </page>
</product>
