<?xml version="1.0" encoding="ISO-8859-1"?>
<!DOCTYPE product PUBLIC "-//Tricklab//DTD Product V1.0//EN" "../../XML/DTD/Product.dtd">

<!-- Description: Plot of Y(t) vs. t, no attributes or titles -->

<product version="1.0">
   <page>
      <plot>
         <curve>
            <var>sys.exec.out.time</var>
            <var>sun_predictor.sun.declination</var>
         </curve>
      </plot>
      <plot>
      	<curve>
      		<varcase>
      			<var>sys.exec.out.time</var>
      			<var>sun_predictor.sun.declination</var>
      		</varcase>
      	</curve>
      </plot>
   </page>
</product>
